{
  "v": "gabp/1",
  "id": "550e8400-e29b-41d4-a716-446655440000",
  "type": "request",
  "method": "session/hello",
  "params": {
    "token": "a1b2c3d4e5f6789012345678901234567890abcdef1234567890abcdef123456",
    "bridgeVersion": "1.0.0",
    "platform": "windows", 
    "launchId": "550e8400-e29b-41d4-a716-446655440001",
    "clientInfo": {
      "name": "GABP Test Client",
      "version": "1.0.0"
    }
  }
}